{
  "run_id": "zeval-zdoc-write-20260615-002",
  "request_hash": "3c2c51d5bb9e1c27",
  "rubric_id": "skill-design",
  "rubric_version": "1.0.0",
  "scores": [
    {
      "judge_id": "j-completeness",
      "dimension": "completeness",
      "score": 0.92,
      "level": "excellent",
      "weight": 1.0,
      "rationale": "全部必备章节齐全且内容充实。包含1.目标与非目标（含目标/非目标子节）、2.输入/输出（含输入/输出子节）、3.执行步骤（Phase 1-4详细展开），以及何时使用/何时不使用的明确区分（Not Equal To + Workflow Boundary + 非目标列表）。额外覆盖了架构图、支持的文档类型、Phase详细展开、Non-Negotiable Rules、Pitfalls、Usage等章节，内容远超最低要求。",
      "evidence_refs": [
        {
          "kind": "line",
          "ref": "skills/zdoc-write/SKILL.md:54",
          "quote": "## 1. 目标与非目标"
        },
        {
          "kind": "line",
          "ref": "skills/zdoc-write/SKILL.md:72",
          "quote": "## 2. 输入/输出"
        },
        {
          "kind": "line",
          "ref": "skills/zdoc-write/SKILL.md:94",
          "quote": "## 3. 执行步骤"
        },
        {
          "kind": "line",
          "ref": "skills/zdoc-write/SKILL.md:31",
          "quote": "- Not a document editor（从零撰写，不修改已有文档）"
        },
        {
          "kind": "line",
          "ref": "skills/zdoc-write/SKILL.md:63",
          "quote": "- **不修改已有文档**：除非用户明确请求更新，否则只从零撰写新文档。"
        },
        {
          "kind": "line",
          "ref": "skills/zdoc-write/SKILL.md:716",
          "quote": "- 不修改已有文档（除非用户明确要求更新）"
        }
      ]
    },
    {
      "judge_id": "j-boundary-clarity",
      "dimension": "boundary-clarity",
      "score": 0.9,
      "level": "excellent",
      "weight": 1.5,
      "rationale": "目标与非目标二分明确。第1.1节列出4项具体目标，第1.2节以'非目标'为标题列出4项'不做什么'，每项均给出替代工具（zdoc-design-check/zdoc-i2i/zdoc-quality-loop）。Not Equal To、Workflow Boundary、Out of scope、Pitfalls多处重复强化边界，非目标具体可验证。",
      "evidence_refs": [
        {
          "kind": "line",
          "ref": "/Users/zengle/git/zeng-skills/skills/zdoc-write/SKILL.md:54",
          "quote": "## 1. 目标与非目标"
        },
        {
          "kind": "line",
          "ref": "/Users/zengle/git/zeng-skills/skills/zdoc-write/SKILL.md:63",
          "quote": "### 1.2 非目标\n\n- **不修改已有文档**：除非用户明确请求更新，否则只从零撰写新文档。\n- **不做文档质量校验**：写完后应调用 `zdoc-design-check` 做质量检查。\n- **不拆分实施任务**：任务分解由 `zdoc-i2i` 负责。\n- **不做多轮评审收敛**：质量循环由 `zdoc-quality-loop` 负责。"
        },
        {
          "kind": "line",
          "ref": "/Users/zengle/git/zeng-skills/skills/zdoc-write/SKILL.md:31",
          "quote": "## Not Equal To\n\n- Not a document editor（从零撰写，不修改已有文档）\n- Not a design check tool（不校验已有文档质量，用 `zdoc-design-check`）\n- Not a task decomposer（不拆分实施任务，用 `zdoc-i2i`）\n- Not a quality loop（不做多轮评审收敛，用 `zdoc-quality-loop`）"
        },
        {
          "kind": "line",
          "ref": "/Users/zengle/git/zeng-skills/skills/zdoc-write/SKILL.md:712",
          "quote": "## Workflow Boundary\n\n- **Out of scope**:\n  - 不修改已有文档（除非用户明确要求更新）\n  - 不校验文档质量（用 `zdoc-design-check`）\n  - 不拆分实施任务（用 `zdoc-i2i`）\n  - 不做多轮评审（用 `zdoc-quality-loop`）"
        }
      ]
    },
    {
      "judge_id": "j-examples-runnable",
      "dimension": "examples-runnable",
      "score": 0.7,
      "level": "good",
      "weight": 1.0,
      "rationale": "Usage section contains 5 concrete command examples with full command names, arguments (--module, --output-dir, --input, --project), and expected output description. However, no expected stdout/result output is shown for any example, and the commands reference a fictional 'zdoc-write' CLI rather than a real executable path. Meets 'good' (命令与参数) but not 'excellent' (缺少预期输出).",
      "evidence_refs": [
        {
          "kind": "file",
          "ref": "/Users/zengle/git/zeng-skills/skills/zdoc-write/SKILL.md:751-768",
          "quote": "```bash\n# 指定类型撰写\nzdoc-write prd --module M12 --output-dir docs/mvp-lite/prds/\n\n# 从内容推断类型\nzdoc-write \"我需要写一个用户注册模块的架构文档，用 React + Go + PostgreSQL\"\n\n# 从现有文件补充\nzdoc-write prd --input docs/drafts/prd-notes.md --output-dir docs/mvp-lite/prds/\n\n# 指定项目路径（用于交叉引用）\nzdoc-write tech --module M12 --project . --output-dir docs/mvp-lite/tech/\n\n# 完整参数\nzdoc-write api --module M12 --output-dir docs/mvp-lite/api/ --project .\n```"
        },
        {
          "kind": "file",
          "ref": "/Users/zengle/git/zeng-skills/skills/zdoc-write/SKILL.md:770",
          "quote": "> **预期输出**：上述命令不会立即落盘最终文档。执行后，`zdoc-write` 会先输出 `## 文档摘要` 供用户确认核心决策点；用户确认后进入 Phase 4 最终化，生成文档本体与决策摘要。"
        }
      ]
    },
    {
      "judge_id": "j-pitfalls",
      "dimension": "pitfalls",
      "score": 0.9,
      "level": "excellent",
      "weight": 0.8,
      "rationale": "SKILL.md 包含 6 条 pitfall，每条均带具体影响与规避方法，满足 excellent 标准（≥3 条且每条带规避方法）。",
      "evidence_refs": [
        {
          "kind": "file",
          "ref": "/Users/zengle/git/zeng-skills/skills/zdoc-write/SKILL.md",
          "quote": "## Pitfalls / 常见坑与规避\n\n| # | 常见坑 | 影响 | 规避方法 |\n|---|--------|------|----------|\n| 1 | 把 `zdoc-write` 当文档编辑器，直接让它修改已有文档 | 可能误删用户内容、破坏版本历史 | 修改已有文档时明确请求更新；日常编辑使用 `zdoc-design-check` 或手动编辑 |\n| 2 | 不指定 `--output-dir` 或 `--module` | 文档散落、命名不规范、交叉引用失效 | 始终显式指定 `--output-dir` 和 `--module` |\n| 3 | 忽略 `[需确认]` 标记，把 AI 补充内容当作用户已确认内容 | 引入未经验证的假设，导致语义漂移 | Phase 4 最终化前必须让用户审阅并确认所有 `[需确认]` 项 |\n| 4 | 撰写 API 文档时不执行 Phase 1.5 变更检测 | 遗漏破坏性变更，下游客户端崩溃 | API 类型强制搜索同模块旧文档；必须输出变更说明或\"首次撰写\"标注 |\n| 5 | Out of Scope 写\"无\"或过于笼统 | scope creep，后续不断追加需求 | 至少列出 3 项具体排除内容，并引用 `Non-Negotiable Rules` 第 4 条 |\n| 6 | 将非 draft 状态的旧文档直接覆盖 | 破坏已 approved/frozen 的基线 | 撰写前检查旧文档状态；如需变更，走显式 supersede 流程并在 frontmatter 中标注 |"
        }
      ]
    }
  ],
  "verdict": {
    "verdict": "pass",
    "score": 0.8581,
    "rationale": "Weighted-mean across 4 dimensions: completeness (0.92 × 1.0), boundary-clarity (0.9 × 1.5), examples-runnable (0.7 × 1.0), pitfalls (0.9 × 0.8). Total = 3.69 / 4.30 = 0.8581. Score is above pass_threshold (0.75). No dimension level=fail blocks because any_dimension_fail_blocks is false. No conflicts detected.",
    "conflicts": []
  },
  "gate": {
    "status": "pass",
    "code": "0",
    "message": "评估通过。completeness 与 pitfalls 维度已从不达标修复为 excellent，boundary-clarity 保持 excellent。examples-runnable 为 good，注意本次该维度相对基线有下降（0.85 → 0.7）。"
  },
  "baseline": {
    "baseline_id": "zeval-zdoc-write-20260615-001",
    "delta": 0.3465,
    "regressed_dimensions": [
      "examples-runnable"
    ]
  },
  "artifacts": {
    "report_path": ".zeval/runs/zeval-zdoc-write-20260615-002/report.json",
    "raw_judgments": [
      ".zeval/runs/zeval-zdoc-write-20260615-002/judgments/j-completeness.json",
      ".zeval/runs/zeval-zdoc-write-20260615-002/judgments/j-boundary-clarity.json",
      ".zeval/runs/zeval-zdoc-write-20260615-002/judgments/j-examples-runnable.json",
      ".zeval/runs/zeval-zdoc-write-20260615-002/judgments/j-pitfalls.json"
    ],
    "replay_bundle": ".zeval/runs/zeval-zdoc-write-20260615-002/replay_bundle"
  },
  "meta": {
    "created_at": "2026-06-15T00:00:00Z",
    "duration_ms": 61832,
    "model_versions": {
      "outer_agent": "kimi-for-coding",
      "judge_pool": "kimi-for-coding"
    }
  }
}
